<?xml version="1.0" ?>
<!DOCTYPE bulletml SYSTEM "../bulletml.dtd">

<bulletml type="vertical"
          xmlns="http://www.asahi-net.or.jp/~cs8k-cyu/bulletml">

<action label="top">
  <repeat><times>5</times><action>
    <fire>
      <direction type="absolute">360 * $rand</direction>
      <bulletRef label="add2way"/>
    </fire>
    <repeat><times>71</times><action>
      <fire>
        <direction type="sequence">5</direction>
        <bulletRef label="add2way"/>
      </fire>
    </action></repeat>

  <wait>30 - 20 * $rank</wait>

  </action></repeat>

  <wait>100</wait>

</action>


<bullet label="add2way">
<speed>2.4 * (0.25 + 0.75 * $rank)</speed>
<action>

  <wait>(24 + 6 * $rand)/ (2.4 * (0.25 + 0.75 * $rank))</wait>

  <fire>
    <direction type="relative">17</direction>
    <speed type="relative">0</speed>
    <bullet/>
  </fire>
  <fire>
    <direction type="relative">-17</direction>
    <speed type="relative">0</speed>
    <bullet/>
  </fire>

</action>
</bullet>

</bulletml>
