<?xml version="1.0" ?>
<!DOCTYPE bulletml SYSTEM "../bulletml.dtd">

<bulletml 
          xmlns="http://www.asahi-net.or.jp/~cs8k-cyu/bulletml">

<fire label="gurutyo">
 <direction type="absolute">90</direction>
 <speed>$1*(3+$rank*4)</speed>

 <bullet>
 <action>

 <changeDirection>
  <direction type="sequence">$1*6</direction>
  <term>1000</term>
 </changeDirection>

 <repeat> <times>500</times>
 <action>

  <fire>
   <direction type="relative">0</direction>
   <bullet/>
  </fire>

  <wait>1</wait>

 </action>
 </repeat>

 <vanish/>

 </action>
 </bullet>
</fire>

<action label="top">
 <fireRef label="gurutyo">
  <param>1</param>
 </fireRef>
 <fireRef label="gurutyo">
  <param>-1</param>
 </fireRef>

 <wait>550</wait>

</action>

</bulletml>
