<?xml version="1.0" ?>
<!DOCTYPE bulletml SYSTEM "../bulletml.dtd">

<bulletml type="vertical"
          xmlns="http://www.asahi-net.or.jp/~cs8k-cyu/bulletml">
<action label="top">

 <fire>
  <direction type="absolute">0</direction>
  <speed>0</speed>
  <bulletRef label="stardust"/>
 </fire>

 <wait>120</wait>

 <repeat> <times>840/(120 - 100 * $rank)</times> <action>
  <fire>
   <direction type="aim">0</direction>
   <speed>1</speed>
   <bulletRef label="laser">
    <param>2</param>
   </bulletRef>
  </fire>
  <fire>
   <direction type="aim">0</direction>
   <speed>1</speed>
   <bulletRef label="laser">
    <param>2.05</param>
   </bulletRef>
  </fire>
  <fire>
   <direction type="aim">0</direction>
   <speed>1</speed>
   <bulletRef label="laser">
    <param>2.1</param>
   </bulletRef>
  </fire>
 <wait>0.5 * (120 - 100 * $rank)</wait>
 </action> </repeat>

 <wait>60</wait>
</action>

<bullet label="stardust">
<action>
 <repeat> <times>5+$rank*10</times> <action>
  <fire>
   <direction type="absolute">135 + 90 * $rand</direction>
   <speed>0.3 + 1.7 * $rand</speed>
   <bulletRef label="stardust2">
    <param>60</param>
    <param>1.2</param>
    <param>0.8</param>
   </bulletRef>
  </fire>

  <fire>
   <direction type="absolute">135 + 90 * $rand</direction>
   <speed>0.3 + 1.7 * $rand</speed>
   <bulletRef label="stardust2">
    <param>68</param>
    <param>0.8</param>
    <param>1.2</param>
   </bulletRef>
  </fire>

  <fire>
   <direction type="absolute">135 + 90 * $rand</direction>
   <speed>0.3 + 1.7 * $rand</speed>
   <bulletRef label="stardust2">
    <param>76</param>
    <param>1.2</param>
    <param>0.8</param>
   </bulletRef>
  </fire>

  <fire>
   <direction type="absolute">135 + 90 * $rand</direction>
   <speed>0.3 + 1.7 * $rand</speed>
   <bulletRef label="stardust2">
    <param>84</param>
    <param>0.8</param>
    <param>1.2</param>
   </bulletRef>
  </fire>
  <wait>960/(10+$rank*20)</wait>
 </action> </repeat>
 <vanish/>

</action> </bullet>

<bullet label="stardust2">

<action>
 <wait>$1</wait>
 <fire>
  <direction type="absolute">0</direction>
  <speed>$2</speed>
  <bullet/>
 </fire>

 <fire>
  <direction type="absolute">30</direction>
  <speed>$3</speed>
  <bullet/>
 </fire>

 <fire>
  <direction type="absolute">60</direction>
  <speed>$2</speed>
  <bullet/>
 </fire>

 <fire>
  <direction type="absolute">90</direction>
  <speed>$3</speed>
  <bullet/>
 </fire>

 <fire>
  <direction type="absolute">120</direction>
  <speed>$2</speed>
  <bullet/>
 </fire>

 <fire>
  <direction type="absolute">150</direction>
  <speed>$3</speed>
  <bullet/>
 </fire>

 <fire>
  <direction type="absolute">180</direction>
  <speed>$2</speed>
  <bullet/>
 </fire>

 <fire>
  <direction type="absolute">210</direction>
  <speed>$3</speed>
  <bullet/>
 </fire>

 <fire>
  <direction type="absolute">240</direction>
  <speed>$2</speed>
  <bullet/>
 </fire>

 <fire>
  <direction type="absolute">270</direction>
  <speed>$3</speed>
  <bullet/>
 </fire>

 <fire>
  <direction type="absolute">300</direction>
  <speed>$2</speed>
  <bullet/>
 </fire>

 <fire>
  <direction type="absolute">330</direction>
  <speed>$3</speed>
  <bullet/>
 </fire>

 <vanish/>
</action> </bullet>

<bullet label="laser">

<action>
 <changeSpeed>
  <speed>$1</speed>
  <term>1</term>
 </changeSpeed>

</action> </bullet>

</bulletml>
