<?xml version="1.0" ?>
<!DOCTYPE bulletml SYSTEM "../bulletml.dtd">

<bulletml type="vertical"
          xmlns="http://www.asahi-net.or.jp/~cs8k-cyu/bulletml">

<action label="top">
 <fire>
  <direction type="absolute">110</direction>
  <speed>3</speed>
  <bulletRef label="armSrc">
   <param>1</param>
  </bulletRef>
 </fire>
 <fire>
  <direction type="absolute">-110</direction>
  <speed>3</speed>
  <bulletRef label="armSrc">
   <param>0</param>
  </bulletRef>
 </fire>

 <wait>400</wait>
</action>

<bullet label="armSrc"> <action>
 <wait>12</wait>
 <fire>
  <direction type="absolute">180</direction>
  <speed>1</speed>
  <bulletRef label="arm">
   <param>$1</param>
   <param>1</param>
  </bulletRef>
 </fire>
 <fire>
  <direction type="absolute">60</direction>
  <speed>1</speed>
  <bulletRef label="arm">
   <param>$1</param>
   <param>1</param>
  </bulletRef>
 </fire>
 <fire>
  <direction type="absolute">-60</direction>
  <speed>1</speed>
  <bulletRef label="arm">
   <param>$1</param>
   <param>1</param>
  </bulletRef>
 </fire>
 <fire>
  <direction type="absolute">180</direction>
  <speed>1</speed>
  <bulletRef label="arm">
   <param>$1</param>
   <param>-1</param>
  </bulletRef>
 </fire>
 <fire>
  <direction type="absolute">60</direction>
  <speed>1</speed>
  <bulletRef label="arm">
   <param>$1</param>
   <param>-1</param>
  </bulletRef>
 </fire>
 <fire>
  <direction type="absolute">-60</direction>
  <speed>1</speed>
  <bulletRef label="arm">
   <param>$1</param>
   <param>-1</param>
  </bulletRef>
 </fire>
 <vanish/>
</action> </bullet>

<bullet label="arm">

<action>
 <wait>12</wait>

 <fire>
  <direction type="relative">180*$1</direction>
  <bullet> <action> <vanish/> </action> </bullet>
 </fire>

 <changeSpeed>
  <speed>0</speed>
  <term>1</term>
 </changeSpeed>

 <repeat> <times>400/(6-$rank*2)</times> <action>
  <wait>6-$rank*2+$rand</wait>
  <fire>
   <direction type="sequence">11*$2</direction>
   <speed>1.5+$rank*0.5</speed>
   <bullet/>
  </fire>
 </action> </repeat>

 <vanish/>


</action> </bullet>

</bulletml>
